File,Paragraph,LIX Score,Longest Sentence,Dependency Parse
f183.txt,"Men runt ekvatorn så bildades aldrig några glaciärer och därför inga rullstensåsar där vattnet kunde samlas. Det är en faktor varför vattnet är ojämnt fördelat. AfrikaEkvatorn går rakt igenom Afrika, därför ligger Afrika i den tropiska och subtropiska zonen, vilket som gör att Afrika får ett väldigt varierat klimat. I den tropiska zonen regnar det från 100mm till 400 mm per månad. Medan i den subtropiska zonen så faller det knappt 10 mm i snitt per månad om inget alls under torkan.",30.74,"AfrikaEkvatorn går rakt igenom Afrika, därför ligger Afrika i den tropiska och subtropiska zonen, vilket som gör att Afrika får ett väldigt varierat klimat.","[(1, 'AfrikaEkvatorn', 2), (2, 'går', 0), (3, 'rakt', 2), (4, 'igenom', 5), (5, 'Afrika', 2), (6, ',', 2), (7, 'därför', 8), (8, 'ligger', 2), (9, 'Afrika', 8), (10, 'i', 15), (11, 'den', 15), (12, 'tropiska', 15), (13, 'och', 14), (14, 'subtropiska', 12), (15, 'zonen', 8), (16, ',', 8), (17, 'vilket', 19), (18, 'som', 19), (19, 'gör', 8), (20, 'att', 22), (21, 'Afrika', 22), (22, 'får', 19), (23, 'ett', 26), (24, 'väldigt', 25), (25, 'varierat', 26), (26, 'klimat', 22), (27, '.', 2)]"
f184.txt,"Vad som lurar i buskarna bakom de tre på hemväg, det törs jag inte berätta!Sandstormar och andra katastrofer väntar den alltmer handlingskraftiga Kuki, som växer med sin uppgift för var dag som går. Paolo är en orolig själ och han är borta på jakt med ""de andra pojkarna"" långa tider. Det är då Kuki verkligen får visa vad hon går för.Ema, som går på internatskola, njuter varje gång han får vara hemma. Han växer upp till en stilig ung man.",23.91,"Sandstormar och andra katastrofer väntar den alltmer handlingskraftiga Kuki, som växer med sin uppgift för var dag som går.","[(1, 'Sandstormar', 5), (2, 'och', 4), (3, 'andra', 4), (4, 'katastrofer', 1), (5, 'väntar', 0), (6, 'den', 9), (7, 'alltmer', 8), (8, 'handlingskraftiga', 9), (9, 'Kuki', 5), (10, ',', 9), (11, 'som', 12), (12, 'växer', 9), (13, 'med', 15), (14, 'sin', 15), (15, 'uppgift', 12), (16, 'för', 18), (17, 'var', 15), (18, 'dag', 17), (19, 'som', 20), (20, 'går', 18), (21, '.', 5)]"
f185.txt,"Australopithecus var den första apan som gick upprätt.Under 600-talet bredde ett Arabrike ut sig runt Medelhavets kuster, de kontrollerade handeln i Nordafrika och spred islam så pass att berberna blev omvända. Berberna var egentligen ett nomadfolk bestående av flera stammar. Araberna etablerade sig även längs Afrikas östkust, och de dominerade handeln totalt med sin väletablerade Indientrafik. Den kom till någon gång under 1100-talet, och gav dem hög ställning.",44.23,"Under 600-talet bredde ett Arabrike ut sig runt Medelhavets kuster, de kontrollerade handeln i Nordafrika och spred islam så pass att berberna blev omvända.","[(1, 'Under', 2), (2, '600-talet', 3), (3, 'bredde', 0), (4, 'ett', 5), (5, 'Arabrike', 3), (6, 'ut', 3), (7, 'sig', 6), (8, 'runt', 10), (9, 'Medelhavets', 10), (10, 'kuster', 3), (11, ',', 3), (12, 'de', 13), (13, 'kontrollerade', 3), (14, 'handeln', 13), (15, 'i', 16), (16, 'Nordafrika', 13), (17, 'och', 18), (18, 'spred', 13), (19, 'islam', 18), (20, 'så', 18), (21, 'pass', 20), (22, 'att', 24), (23, 'berberna', 24), (24, 'blev', 18), (25, 'omvända', 24), (26, '.', 3)]"
f186.txt,Detta borde man göra ett arbete för att stoppa. Man kunde t ex plantera träd där det är fält som sanden kan blåsa sig till hur lätt som helst. Och samtidigt som man försvårar ökenspridningen så ger man en del ett arbete.Befolkning: i Afrika bodde det 770 miljoner människor år 1997. Man kan tro att Afrika är den folktätaste världsdelen men det är den inte. Det finns ställen i Afrika man inte kan bo på så då är inte Afrika så stor boyta längre.,23.91,Man kunde t ex plantera träd där det är fält som sanden kan blåsa sig till hur lätt som helst.,"[(1, 'Man', 4), (2, 'kunde', 4), (3, 't ex', 4), (4, 'plantera', 0), (5, 'träd', 4), (6, 'där', 9), (7, 'det', 9), (8, 'är', 9), (9, 'fält', 5), (10, 'som', 13), (11, 'sanden', 13), (12, 'kan', 13), (13, 'blåsa', 9), (14, 'sig', 13), (15, 'till', 17), (16, 'hur', 17), (17, 'lätt', 13), (18, 'som', 17), (19, 'helst', 17), (20, '.', 4)]"
f187.txt,"Eftersom Waris själv varit med om ingreppet beskriver hon väldigt detaljrikt händelsen, man riktigt vrider på sig när man sakta läser och förstår hur ont det måste göra. Det som förvånar mig mest är hur föräldrarna kan låta detta ske, eftersom i nästan alla föräldrar finns det en instinkt att skydda sin barn från allt ont och ingen vill väl se sitt eget barn lida.",41.67,"Det som förvånar mig mest är hur föräldrarna kan låta detta ske, eftersom i nästan alla föräldrar finns det en instinkt att skydda sin barn från allt ont och ingen vill väl se sitt eget barn lida.","[(1, 'Det', 0), (2, 'som', 3), (3, 'förvånar', 1), (4, 'mig', 3), (5, 'mest', 3), (6, 'är', 1), (7, 'hur', 10), (8, 'föräldrarna', 10), (9, 'kan', 10), (10, 'låta', 1), (11, 'detta', 10), (12, 'ske', 10), (13, ',', 19), (14, 'eftersom', 19), (15, 'i', 18), (16, 'nästan', 17), (17, 'alla', 18), (18, 'föräldrar', 19), (19, 'finns', 10), (20, 'det', 19), (21, 'en', 22), (22, 'instinkt', 19), (23, 'att', 24), (24, 'skydda', 22), (25, 'sin', 26), (26, 'barn', 24), (27, 'från', 29), (28, 'allt', 29), (29, 'ont', 24), (30, 'och', 34), (31, 'ingen', 34), (32, 'vill', 34), (33, 'väl', 34), (34, 'se', 19), (35, 'sitt', 37), (36, 'eget', 37), (37, 'barn', 34), (38, 'lida', 34), (39, '.', 1)]"
f188.txt,"Nykolonialism utövades mest av Storbritannien och Frankrike. De fortsätter att ha inflytande över sina gamla kolonier.Vad kom först?Kolonialismen kom före imperialismen. Eller gjorde den verkligen det?I modern europeisk tid är detta ett faktum. På 1500-talet började vi kolonisera delar av världen, detta övergick sedan till imperialism. Ledarna började få smak på att utvidga sitt lands möjligheter och ville inte bara öka landets ekonomiska tillväxt utan även rikets gränser.",41.33,Ledarna började få smak på att utvidga sitt lands möjligheter och ville inte bara öka landets ekonomiska tillväxt utan även rikets gränser.,"[(1, 'Ledarna', 2), (2, 'började', 0), (3, 'få', 2), (4, 'smak', 3), (5, 'på', 7), (6, 'att', 7), (7, 'utvidga', 3), (8, 'sitt', 9), (9, 'lands', 10), (10, 'möjligheter', 7), (11, 'och', 15), (12, 'ville', 15), (13, 'inte', 15), (14, 'bara', 15), (15, 'öka', 7), (16, 'landets', 18), (17, 'ekonomiska', 18), (18, 'tillväxt', 15), (19, 'utan', 22), (20, 'även', 22), (21, 'rikets', 22), (22, 'gränser', 18), (23, '.', 2)]"
f189.txt,"Nomader har ett sällsynt lokalsinne som alltid för dem tillbaka till flocken. När Waris är 12 år anser hennes far att det är dags för Waris att gifta sig. En 60-årig väljs ut och är den som skall bli Waris äkta make. Att Waris blir olycklig är inget man förvånas över. Precis som sin äldre syster någongång i tiden gjorde, bestämmer sig Waris för att rymma. Genom milslång öken springer en spinkig liten flicka barfota i flera veckor för att leta redan på en släkting bosatt i Mogadishu.",29.57,Genom milslång öken springer en spinkig liten flicka barfota i flera veckor för att leta redan på en släkting bosatt i Mogadishu.,"[(1, 'Genom', 3), (2, 'milslång', 3), (3, 'öken', 4), (4, 'springer', 0), (5, 'en', 8), (6, 'spinkig', 8), (7, 'liten', 8), (8, 'flicka', 4), (9, 'barfota', 4), (10, 'i', 12), (11, 'flera', 12), (12, 'veckor', 4), (13, 'för', 15), (14, 'att', 15), (15, 'leta', 4), (16, 'redan', 19), (17, 'på', 19), (18, 'en', 19), (19, 'släkting', 15), (20, 'bosatt', 15), (21, 'i', 22), (22, 'Mogadishu', 20), (23, '.', 4)]"
f19.txt,Efter New Orleans jazzen så blev Chicago jazzen det stora detta tog sin start 1920. Den nya Chicago stilen innehöll mer solon och arrangerad musik. I Chicago lyftes soloimprovisationen fram tillskillnad från tidigare då solot hade mindre betydelse. Det största och ett av de allra kändaste namnen från den här tiden var Louis Armstrong. Han gick med i Joe Olivers band Creole jazz band 1922. När Louis spela i det bandet lärde han sig väldigt mycket.,30.59,I Chicago lyftes soloimprovisationen fram tillskillnad från tidigare då solot hade mindre betydelse.,"[(1, 'I', 2), (2, 'Chicago', 3), (3, 'lyftes', 0), (4, 'soloimprovisationen', 3), (5, 'fram', 3), (6, 'tillskillnad', 3), (7, 'från', 8), (8, 'tidigare', 3), (9, 'då', 11), (10, 'solot', 11), (11, 'hade', 3), (12, 'mindre', 13), (13, 'betydelse', 11), (14, '.', 3)]"
f190.txt,"Man försöker också utveckla metoderna för att lättare kunna mäta hälsotillståndet i Afrika.”De fyra S:en”  Ett stort hinder i arbetet är ”De fyra S:en” S:en står för silence, shame, stigma och superstition, d.v.s. tystnad, skam, brännmärkt och vidskepelse. Många afrikanska regeringar vill helt enkelt inte erkänna att HIV/AIDS är ett stort problem, trots att miljoner dör i landet. Dessa länder är oftast inte beredda att ta emot hjälp heller.",31.87,"Många afrikanska regeringar vill helt enkelt inte erkänna att HIV/AIDS är ett stort problem, trots att miljoner dör i landet.","[(1, 'Många', 3), (2, 'afrikanska', 3), (3, 'regeringar', 8), (4, 'vill', 8), (5, 'helt', 8), (6, 'enkelt', 5), (7, 'inte', 8), (8, 'erkänna', 0), (9, 'att', 14), (10, 'HIV/AIDS', 14), (11, 'är', 14), (12, 'ett', 14), (13, 'stort', 14), (14, 'problem', 8), (15, ',', 14), (16, 'trots', 19), (17, 'att', 16), (18, 'miljoner', 19), (19, 'dör', 14), (20, 'i', 21), (21, 'landet', 19), (22, '.', 8)]"
f191.txt,"Dom hade starka band mellan sig och stod varandra nära. Det där var en liten sammanfattning från dom första kapitlerna, jag lyfte fram det jag tyckte var bäst i början, Waris relation till sin mamma och delvis hennes pappa. Början var inte så vidare bra vilket gjorde att jag inte kände mig inspirerad till att fortsätta läsa boken.",24.84,"Det där var en liten sammanfattning från dom första kapitlerna, jag lyfte fram det jag tyckte var bäst i början, Waris relation till sin mamma och delvis hennes pappa.","[(1, 'Det', 6), (2, 'där', 6), (3, 'var', 6), (4, 'en', 6), (5, 'liten', 6), (6, 'sammanfattning', 0), (7, 'från', 10), (8, 'dom', 10), (9, 'första', 10), (10, 'kapitlerna', 6), (11, ',', 6), (12, 'jag', 13), (13, 'lyfte', 6), (14, 'fram', 13), (15, 'det', 13), (16, 'jag', 17), (17, 'tyckte', 15), (18, 'var', 17), (19, 'bäst', 17), (20, 'i', 21), (21, 'början', 17), (22, ',', 24), (23, 'Waris', 24), (24, 'relation', 13), (25, 'till', 27), (26, 'sin', 27), (27, 'mamma', 24), (28, 'och', 31), (29, 'delvis', 31), (30, 'hennes', 31), (31, 'pappa', 27), (32, '.', 6)]"
f192.txt,"Den främsta anledningen till att de ockuperades är att det finns otroliga naturresurser i Västsahara i form utav uran, fiskevatten och även misstankar om att det finns olja. Oljehandeln är någonting som Marocko uppenbarligen är mycket intresserade av i och med att det genererar mycket pengar och är någonting som behövs för att en industriell revolution skall kunna genomföras.",50.18,Oljehandeln är någonting som Marocko uppenbarligen är mycket intresserade av i och med att det genererar mycket pengar och är någonting som behövs för att en industriell revolution skall kunna genomföras.,"[(1, 'Oljehandeln', 3), (2, 'är', 3), (3, 'någonting', 0), (4, 'som', 9), (5, 'Marocko', 9), (6, 'uppenbarligen', 9), (7, 'är', 9), (8, 'mycket', 9), (9, 'intresserade', 3), (10, 'av', 4), (11, 'i', 16), (12, 'och', 11), (13, 'med', 11), (14, 'att', 16), (15, 'det', 16), (16, 'genererar', 9), (17, 'mycket', 18), (18, 'pengar', 16), (19, 'och', 21), (20, 'är', 21), (21, 'någonting', 9), (22, 'som', 23), (23, 'behövs', 21), (24, 'för', 31), (25, 'att', 24), (26, 'en', 28), (27, 'industriell', 28), (28, 'revolution', 31), (29, 'skall', 31), (30, 'kunna', 31), (31, 'genomföras', 23), (32, '.', 3)]"
f193.txt,Men jag tog bara jätte lite information från Wikipedia eftersom jag redan hade tillräckligt med information från mina andra källor.,35.0,Men jag tog bara jätte lite information från Wikipedia eftersom jag redan hade tillräckligt med information från mina andra källor.,"[(1, 'Men', 3), (2, 'jag', 3), (3, 'tog', 0), (4, 'bara', 3), (5, 'jätte', 6), (6, 'lite', 7), (7, 'information', 3), (8, 'från', 9), (9, 'Wikipedia', 3), (10, 'eftersom', 13), (11, 'jag', 13), (12, 'redan', 13), (13, 'hade', 3), (14, 'tillräckligt', 16), (15, 'med', 16), (16, 'information', 13), (17, 'från', 20), (18, 'mina', 20), (19, 'andra', 20), (20, 'källor', 16), (21, '.', 3)]"
f194.txt,"Det är detta tillstånd som man kallar för aids. Så vitt man vet så leder en obehandlad hiv-infektion förr eller senare till döden.Det finns en storts medicin som bromsar sjukdomsförloppet, den heter bromsmedicin. Den medicinen kan hålla virushalten i blodet på en så låg nivå så att immunförsvaret inte slås ut och den smittade inte utvecklar aids. Smittsamheten vid en effektiv behandling minskar.",35.45,Den medicinen kan hålla virushalten i blodet på en så låg nivå så att immunförsvaret inte slås ut och den smittade inte utvecklar aids.,"[(1, 'Den', 2), (2, 'medicinen', 4), (3, 'kan', 4), (4, 'hålla', 0), (5, 'virushalten', 4), (6, 'i', 7), (7, 'blodet', 4), (8, 'på', 12), (9, 'en', 12), (10, 'så', 11), (11, 'låg', 12), (12, 'nivå', 4), (13, 'så', 17), (14, 'att', 13), (15, 'immunförsvaret', 17), (16, 'inte', 17), (17, 'slås', 4), (18, 'ut', 17), (19, 'och', 23), (20, 'den', 21), (21, 'smittade', 23), (22, 'inte', 23), (23, 'utvecklar', 17), (24, 'aids', 23), (25, '.', 4)]"
f195.txt,"Med guld framför näsan tänkte han att det kanske finns en annan väg och ta sig, det var så portugiserna började upptäcka Afrika till sjös.  Vem spred skräckhistorier om Atlanten och varför?Fenicierna hade länge varit de som haft hand om handeln runt omkring Atlanten. De hade så spridit rykten om mörkrets hav för att skydda sina tillgångarHur skulle dyra varor från Asien kunna bli billigare i Europa Handel runt Asien var uppbyggd på många händer och alla skulle känna på affärerna.",35.91,De hade så spridit rykten om mörkrets hav för att skydda sina tillgångarHur skulle dyra varor från Asien kunna bli billigare i Europa Handel runt Asien var uppbyggd på många händer och alla skulle känna på affärerna.,"[(1, 'De', 4), (2, 'hade', 4), (3, 'så', 4), (4, 'spridit', 0), (5, 'rykten', 4), (6, 'om', 8), (7, 'mörkrets', 8), (8, 'hav', 5), (9, 'för', 11), (10, 'att', 11), (11, 'skydda', 4), (12, 'sina', 13), (13, 'tillgångar', 11)]"
f196.txt,"Redan mer än 8000 år innan upptäckten så bodde indianerna. Men vid slutet av 1400-talet så bodde det halvnomadiska stammar. De levde på samlande, jordbrud, fiske och främst jakt.  Under kolonialstyrelsen: Som sagt så erövrade Portugal Brasilien på 1500-talet men inte förrän år 1530 så började man vissa något intresse för sin koloni.",32.82,Under kolonialstyrelsen: Som sagt så erövrade Portugal Brasilien på 1500-talet men inte förrän år 1530 så började man vissa något intresse för sin koloni.,"[(1, 'Under', 2), (2, 'kolonialstyrelsen', 0), (3, ':', 2)]"
f197.txt,Det oroade de amerikanska säkerhetstjänsterna och hans egna tidning  The Negro World förbjöds av  flera av de brittiska kolonierna.,41.08,Det oroade de amerikanska säkerhetstjänsterna och hans egna tidning  The Negro World förbjöds av  flera av de brittiska kolonierna.,"[(1, 'Det', 2), (2, 'oroade', 0), (3, 'de', 5), (4, 'amerikanska', 5), (5, 'säkerhetstjänsterna', 2), (6, 'och', 13), (7, 'hans', 9), (8, 'egna', 9), (9, 'tidning', 10), (10, 'The', 12), (11, 'Negro', 10), (12, 'World', 13), (13, 'förbjöds', 2), (14, 'av', 15), (15, 'flera', 13), (16, 'av', 19), (17, 'de', 19), (18, 'brittiska', 19), (19, 'kolonierna', 15), (20, '.', 2)]"
f198.txt,"Columbus visste att jorden var rund och ville försöka nå Indien västerut, men missbedömde avståndet rejält.       1492 fick han efter många ”nej” det spanska kungaparet att bekosta resan. Han seglade iväg den 6 september samma år och 33 dagar senare trodde han sig ha kommit till Indien.        Han hade lovat att föra med sig guld tillbaka till kungaparet och därför blev det en besvikelse när han möttes av fattigdom. Han lyckades få tag i lite guld och begav sig sedan hemåt.",32.02,Han hade lovat att föra med sig guld tillbaka till kungaparet och därför blev det en besvikelse när han möttes av fattigdom.,"[(1, 'Han', 3), (2, 'hade', 3), (3, 'lovat', 0), (4, 'att', 5), (5, 'föra', 3), (6, 'med', 5), (7, 'sig', 6), (8, 'guld', 5), (9, 'tillbaka', 5), (10, 'till', 11), (11, 'kungaparet', 9), (12, 'och', 14), (13, 'därför', 14), (14, 'blev', 3), (15, 'det', 14), (16, 'en', 17), (17, 'besvikelse', 14), (18, 'när', 20), (19, 'han', 20), (20, 'möttes', 14), (21, 'av', 22), (22, 'fattigdom', 20), (23, '.', 3)]"
f199.txt,"Men om vi köper för billigt, så det inte ens räcker till mat för dagen till dem, då är det att utnyttja.Om vi nu samarbetar så hjälper vi dom sjuka att bli friskare.På så sätt kan de bygga upp sitt samhälle. De slipper bo i hus gjorda av gammalt skräp som även förstör miljön. Ett kretslopp som är bra för miljön och mänskligheten, bör uppmuntras.Afrikas odlingarDet kan vara ganska svårt att livnära sig på växter i Afrika, eftersom det är så torr mark.",30.89,"Afrikas odlingarDet kan vara ganska svårt att livnära sig på växter i Afrika, eftersom det är så torr mark.","[(1, 'Afrikas', 2), (2, 'odlingar', 0)]"
f20.txt,"Man trodde att de som hade en tattuering var en buse ""lagförbrytare"" men så var det absolut inte. Det var många sjömänn som tattuerade sig runt 1800 talet. De tattuerade in något som hade med det de älskade att göra oftast. Som te.x hjärtan med namn på den de älskade, ankare, skepp, fyrar och fåglar. De motiv finns det fortfarande folk idag som tattuerar utan att behöva vara en sjömann.",27.04,"Man trodde att de som hade en tattuering var en buse ""lagförbrytare"" men så var det absolut inte.","[(1, 'Man', 2), (2, 'trodde', 0), (3, 'att', 12), (4, 'de', 12), (5, 'som', 6), (6, 'hade', 4), (7, 'en', 8), (8, 'tattuering', 6), (9, 'var', 12), (10, 'en', 11), (11, 'buse', 12), (12, '""lagförbrytare""', 2), (13, 'men', 18), (14, 'så', 18), (15, 'var', 18), (16, 'det', 18), (17, 'absolut', 18), (18, 'inte', 12), (19, '.', 2)]"
f200.txt,"HändelseförloppDen första kolonin i Afrika grundades av holländarna. De intog en stor del i södra Afrika och den delen döptes till Kapkolonin. Den grundades på 1600-talet. Det var inte så många som tänkte på att Afrika fanns eftersom det var så intressant med Amerika vid just denna tid. De inre delarna av Afrika lämnades orörda. De första länderna som var med och koloniserade Afrika var: Storbritannien, Frankrike och Portugal. Storbritannien intog Kapland, Sierra Leone och Guldkusten.",34.3,Det var inte så många som tänkte på att Afrika fanns eftersom det var så intressant med Amerika vid just denna tid.,"[(1, 'Det', 5), (2, 'var', 5), (3, 'inte', 5), (4, 'så', 5), (5, 'många', 0), (6, 'som', 7), (7, 'tänkte', 5), (8, 'på', 11), (9, 'att', 11), (10, 'Afrika', 11), (11, 'fanns', 7), (12, 'eftersom', 16), (13, 'det', 16), (14, 'var', 16), (15, 'så', 16), (16, 'intressant', 7), (17, 'med', 18), (18, 'Amerika', 16), (19, 'vid', 22), (20, 'just', 22), (21, 'denna', 22), (22, 'tid', 16), (23, '.', 5)]"
f201.txt,"Men de var också riktigt noga med att slavarna skulle vara vid liv när de kom fram till Amerika. Skeppen var mycket ohygieniska, slavarna fick t.ex. ”gå på toaletten” under däck där de tillbringade tiden under hela resan. Sjukdomar kunde sprida sig väldigt snabbt så när besättningen märkte att någon började bli sjuk så kastade man de överbord, det spelade ingen roll om de var levande eller döda.Slavarna fick äta majsmjöl, vatten och lite ris under resan.",34.07,"Sjukdomar kunde sprida sig väldigt snabbt så när besättningen märkte att någon började bli sjuk så kastade man de överbord, det spelade ingen roll om de var levande eller döda.","[(1, 'Sjukdomar', 3), (2, 'kunde', 3), (3, 'sprida', 0), (4, 'sig', 3), (5, 'väldigt', 6), (6, 'snabbt', 3), (7, 'så', 10), (8, 'när', 7), (9, 'besättningen', 10), (10, 'märkte', 3), (11, 'att', 13), (12, 'någon', 13), (13, 'började', 10), (14, 'bli', 13), (15, 'sjuk', 14), (16, 'så', 17), (17, 'kastade', 3), (18, 'man', 17), (19, 'de', 17), (20, 'överbord', 17), (21, ',', 3), (22, 'det', 23), (23, 'spelade', 3), (24, 'ingen', 25), (25, 'roll', 23), (26, 'om', 29), (27, 'de', 29), (28, 'var', 29), (29, 'levande', 23), (30, 'eller', 31), (31, 'döda', 29), (32, '.', 3)]"
f202.txt,"Nigeria är det land i Afrika som har störst antal invånare. I Nigeria bor det faktiskt mer än 140 miljoner människor. Befolkningen koncentreras till tre områden: det sydvästra, yorubaland, som innehåller det subsahariska Afrikas två största städer (Lagos och Ibadan), det östcentrala, igboland, samt savannområdena i norr kring Kano, där befolkningen domineras av hausa/fulani.Ca hälften av alla nigerianer är under 19 år.  Kvinnor är cirka 50.6 % av befolkningen och männen så är det 49.",42.17,"Befolkningen koncentreras till tre områden: det sydvästra, yorubaland, som innehåller det subsahariska Afrikas två största städer (Lagos och Ibadan), det östcentrala, igboland, samt savannområdena i norr kring Kano, där befolkningen domineras av hausa/fulani.","[(1, 'Befolkningen', 2), (2, 'koncentreras', 0), (3, 'till', 5), (4, 'tre', 5), (5, 'områden', 2), (6, ':', 5), (7, 'det', 8), (8, 'sydvästra', 5), (9, ',', 10), (10, 'yorubaland', 8), (11, ',', 10), (12, 'som', 13), (13, 'innehåller', 10), (14, 'det', 16), (15, 'subsahariska', 16), (16, 'Afrikas', 19), (17, 'två', 19), (18, 'största', 19), (19, 'städer', 13), (20, '(', 19), (21, 'Lagos', 19), (22, 'och', 23), (23, 'Ibadan', 21), (24, ')', 19), (25, ',', 27), (26, 'det', 27), (27, 'östcentrala', 8), (28, ',', 29), (29, 'igboland', 27), (30, ',', 32), (31, 'samt', 32), (32, 'savannområdena', 8), (33, 'i', 32), (34, 'norr', 33), (35, 'kring', 36), (36, 'Kano', 32), (37, ',', 36), (38, 'där', 40), (39, 'befolkningen', 40), (40, 'domineras', 36), (41, 'av', 42), (42, 'hausa/fulani', 40), (43, '.', 2)]"
f203.txt,Urbefolkningen alltså ”indianerna” tvingande arbeta med sockerrörsproduktionen som trivdes väldigt bra kring karibiska havet. Arbetarna avled snart i sjukdomar som européerna förde med sig. Därför fick de iden att transportera slavar från Afrika till Amerika som fick jobba på plantage. Först och främst var det de manliga slavarna som efterfrågades sedan skulle man använda sig av kvinnliga slavar. Genomsnittet av slavarna var 75 % män medans 25 % var kvinnor.Frågor:Fråga.,40.0,Urbefolkningen alltså ”indianerna” tvingande arbeta med sockerrörsproduktionen som trivdes väldigt bra kring karibiska havet.,"[(1, 'Urbefolkningen', 5), (2, 'alltså', 3), (3, '”indianerna”', 5), (4, 'tvingande', 5), (5, 'arbeta', 0), (6, 'med', 7), (7, 'sockerrörsproduktionen', 5), (8, 'som', 9), (9, 'trivdes', 7), (10, 'väldigt', 11), (11, 'bra', 9), (12, 'kring', 14), (13, 'karibiska', 14), (14, 'havet', 9), (15, '.', 5)]"
f204.txt,"Flera år tidigare, år 1484 försökte Christofer Columbus lägga fram sin idé om att segla åt väst istället för öst för att komma till Indien för den portugisiske kungen. Det gick inget vidare där så han försökte i Spanien där han lyckades. År 1492 seglade han ifrån Spanien och två månader senare kom han fram till Västindien.",37.06,"Flera år tidigare, år 1484 försökte Christofer Columbus lägga fram sin idé om att segla åt väst istället för öst för att komma till Indien för den portugisiske kungen.","[(1, 'Flera', 2), (2, 'år', 3), (3, 'tidigare', 7), (4, ',', 3), (5, 'år', 6), (6, '1484', 3), (7, 'försökte', 0), (8, 'Christofer', 7), (9, 'Columbus', 8), (10, 'lägga', 7), (11, 'fram', 10), (12, 'sin', 13), (13, 'idé', 10), (14, 'om', 16), (15, 'att', 16), (16, 'segla', 10), (17, 'åt', 18), (18, 'väst', 16), (19, 'istället', 21), (20, 'för', 19), (21, 'öst', 16), (22, 'för', 24), (23, 'att', 24), (24, 'komma', 16), (25, 'till', 26), (26, 'Indien', 24), (27, 'för', 30), (28, 'den', 30), (29, 'portugisiske', 30), (30, 'kungen', 24), (31, '.', 7)]"
f206.txt,"Frihandeln var till en början mycket gynnsam för Storbritannien, men med det övriga Europas snabba industrialisering ökade konkurrensen både om råvarorna och de nya industriprodukterna.De europeiska industriländerna hämtade viktiga råvaror från Asien, Afrika och Latinamerika.I Indien slogs de inhemska bomullstygerna ut av de billiga kläderna från Englands textilfabriker.Allteftersom konkurrensen ökade, började allt fler politiker tala för återinförandet av tullar.",52.72,"Frihandeln var till en början mycket gynnsam för Storbritannien, men med det övriga Europas snabba industrialisering ökade konkurrensen både om råvarorna och de nya industriprodukterna.","[(1, 'Frihandeln', 7), (2, 'var', 7), (3, 'till', 5), (4, 'en', 5), (5, 'början', 7), (6, 'mycket', 7), (7, 'gynnsam', 0), (8, 'för', 9), (9, 'Storbritannien', 7), (10, ',', 18), (11, 'men', 18), (12, 'med', 17), (13, 'det', 17), (14, 'övriga', 17), (15, 'Europas', 17), (16, 'snabba', 17), (17, 'industrialisering', 18), (18, 'ökade', 7), (19, 'konkurrensen', 18), (20, 'både', 22), (21, 'om', 22), (22, 'råvarorna', 18), (23, 'och', 26), (24, 'de', 26), (25, 'nya', 26), (26, 'industriprodukterna', 22), (27, '.', 7)]"
