File,Paragraph,LIX Score,Longest Sentence,Dependency Parse
diva1.txt,"Det är  lätt att låsa tanken och tro att det ena ger det andra och att organisation och orientering  endast blir en logisk följd av alla ”hårda” värden som måste uppfyllas.  Här gäller tålamod, det går alltid att pröva flera lösningar och att också ta in mjukare värden i  denna grundläggande planering. Erfarenheten ger att det trots allt alltid finns flera lösningar  på ett problem. Det blir till sist en fråga om kloka val och prioriteringar.",30.99,Det är  lätt att låsa tanken och tro att det ena ger det andra och att organisation och orientering  endast blir en logisk följd av alla ”hårda” värden som måste uppfyllas.,"[(1, 'Det', 3), (2, 'är', 3), (3, 'lätt', 0), (4, 'att', 5), (5, 'låsa', 3), (6, 'tanken', 5), (7, 'och', 8), (8, 'tro', 5), (9, 'att', 12), (10, 'det', 11), (11, 'ena', 12), (12, 'ger', 8), (13, 'det', 14), (14, 'andra', 12), (15, 'och', 21), (16, 'att', 21), (17, 'organisation', 21), (18, 'och', 19), (19, 'orientering', 17), (20, 'endast', 21), (21, 'blir', 12), (22, 'en', 24), (23, 'logisk', 24), (24, 'följd', 21), (25, 'av', 28), (26, 'alla', 28), (27, '”hårda”', 28), (28, 'värden', 24), (29, 'som', 31), (30, 'måste', 31), (31, 'uppfyllas', 28), (32, '.', 3)]"
diva10.txt,"Ett starkt flöde av gångtrafikanter finns på platsen, de flesta från t-bane uppgången. Dessa rör sig främst till och från t-baneuppgången. Tre trappor som leder en från Hornsbruksgatan till Högalidsparken har  visat sig vid observationer att fungera dåligt. Få människor använder trap- porna i relation till det starka flöde som finns. Målet är att skapa en mjuk övergång mellan bergsvägg och Hornsbruks- gatan, genom en fusion mellan byggnadstypologi och topografi.",35.61,"Målet är att skapa en mjuk övergång mellan bergsvägg och Hornsbruks- gatan, genom en fusion mellan byggnadstypologi och topografi.","[(1, 'Målet', 0), (2, 'är', 1), (3, 'att', 4), (4, 'skapa', 1), (5, 'en', 7), (6, 'mjuk', 7), (7, 'övergång', 4), (8, 'mellan', 9), (9, 'bergsvägg', 4), (10, 'och', 11), (11, 'Hornsbruks-', 12), (12, 'gatan', 9), (13, ',', 16), (14, 'genom', 16), (15, 'en', 16), (16, 'fusion', 4), (17, 'mellan', 18), (18, 'byggnadstypologi', 16), (19, 'och', 20), (20, 'topografi', 18), (21, '.', 1)]"
diva100.txt,"Både energikonsumtion samt luftföroreningar har  jämförts. De valda transportslagen är bil, buss och tunnelbana.    Traditionellt sett så har järnvägsindustrin haft just miljöargumenten som en stark fördel när det  gäller passagerartrafik. Men de senaste åren har bilindustrin fått mer och mer utrymme I media  när det gäller miljöfrågor. T.ex. Roger Kemps uttalande att bilen är de mest miljövänliga  passagerartransportmedlet i UK.",33.85,Traditionellt sett så har järnvägsindustrin haft just miljöargumenten som en stark fördel när det  gäller passagerartrafik.,"[(1, 'Traditionellt', 2), (2, 'sett', 6), (3, 'så', 6), (4, 'har', 6), (5, 'järnvägsindustrin', 6), (6, 'haft', 0), (7, 'just', 8), (8, 'miljöargumenten', 6), (9, 'som', 12), (10, 'en', 12), (11, 'stark', 12), (12, 'fördel', 6), (13, 'när', 16), (14, 'det', 13), (15, 'gäller', 13), (16, 'passagerartrafik', 12), (17, '.', 6)]"
diva101.txt,"Produktfamiljen skulle dessutom erbjuda  aktiviteter för alla kvarterets invånare, och på så sätt förvandla innergården till en naturlig  mötesplats.    Examensarbetet har fokuserat på att ta fram koncept anpassade efter önskemål från såväl inköpare  som människor som vistas i det offentliga rummet och som samtidigt är möjliga att tillverka och  sälja med god förtjänst.",59.18,Examensarbetet har fokuserat på att ta fram koncept anpassade efter önskemål från såväl inköpare  som människor som vistas i det offentliga rummet och som samtidigt är möjliga att tillverka och  sälja med god förtjänst.,"[(1, 'Examensarbetet', 3), (2, 'har', 3), (3, 'fokuserat', 0), (4, 'på', 6), (5, 'att', 6), (6, 'ta', 3), (7, 'fram', 6), (8, 'koncept', 6), (9, 'anpassade', 6), (10, 'efter', 11), (11, 'önskemål', 6), (12, 'från', 14), (13, 'såväl', 14), (14, 'inköpare', 11), (15, 'som', 16), (16, 'människor', 14), (17, 'som', 18), (18, 'vistas', 16), (19, 'i', 22), (20, 'det', 22), (21, 'offentliga', 22), (22, 'rummet', 18), (23, 'och', 27), (24, 'som', 27), (25, 'samtidigt', 27), (26, 'är', 27), (27, 'möjliga', 18), (28, 'att', 29), (29, 'tillverka', 27), (30, 'och', 31), (31, 'sälja', 29), (32, 'med', 34), (33, 'god', 34), (34, 'förtjänst', 29), (35, '.', 3)]"
diva102.txt,"Lektion.se är en sajt  som startades 2003 och ger dess medlemmar möjlighet att dela med sig av lektionsidéer,  diskutera intressanta frågor och ge tips och råd till andra medlemmar. Examensarbetet  fokuserar på hur lärarna definierar och använder sajten för kunskapsdelning samt vilka  förbättringar som kan göras för att upprätthålla och i bästa fall öka kunskapsdelningen mellan  medlemmarna.",45.53,Examensarbetet  fokuserar på hur lärarna definierar och använder sajten för kunskapsdelning samt vilka  förbättringar som kan göras för att upprätthålla och i bästa fall öka kunskapsdelningen mellan  medlemmarna.,"[(1, 'Examensarbetet', 2), (2, 'fokuserar', 0), (3, 'på', 6), (4, 'hur', 6), (5, 'lärarna', 6), (6, 'definierar', 2), (7, 'och', 8), (8, 'använder', 6), (9, 'sajten', 6), (10, 'för', 11), (11, 'kunskapsdelning', 6), (12, 'samt', 17), (13, 'vilka', 14), (14, 'förbättringar', 17), (15, 'som', 17), (16, 'kan', 17), (17, 'göras', 6), (18, 'för', 20), (19, 'att', 20), (20, 'upprätthålla', 17), (21, 'och', 25), (22, 'i', 24), (23, 'bästa', 24), (24, 'fall', 25), (25, 'öka', 20), (26, 'kunskapsdelningen', 20), (27, 'mellan', 28), (28, 'medlemmarna', 26), (29, '.', 2)]"
diva103.txt,Robotarna heter Fish respektive Bird och därav projektnamnet Fish-Bird.  Detta examensarbete utvärderar Fish-Birds navigeringssystem. Bakgrunden till  utvärderingen är en oklarhet i huruvida navigeringssystem är ofullständigt eller felaktigt.  Navigeringssystemet har visat bristande funktionalitet vid upprepade tillfällen. En stor  del av problematiken förekommer oftast när hinder befinner sig nära varandra.  Studien är gjord genom en detaljerad analys av Fish-Birds navigeringssystem.,49.7,Bakgrunden till  utvärderingen är en oklarhet i huruvida navigeringssystem är ofullständigt eller felaktigt.,"[(1, 'Bakgrunden', 6), (2, 'till', 3), (3, 'utvärderingen', 1), (4, 'är', 6), (5, 'en', 6), (6, 'oklarhet', 0), (7, 'i', 11), (8, 'huruvida', 11), (9, 'navigeringssystem', 11), (10, 'är', 11), (11, 'ofullständigt', 6), (12, 'eller', 13), (13, 'felaktigt', 11), (14, '.', 6)]"
diva105.txt,"Arbetet har anpassats till de idag framtagna Europastandarderna för energiberäkning av  byggnader. Alla regler har av praktiska skäl inte kunnat implementeras i EBBA. För att nå  tillräcklig noggrannhet i beräkningarna avseende kylbehov har timvärden används. Dessa har  införts i beräkningarna för ventilation, köldbryggor, transmission och luftläckage då alla är  beroende av utomhustemperaturens variation över dygnet.",54.64,"Dessa har  införts i beräkningarna för ventilation, köldbryggor, transmission och luftläckage då alla är  beroende av utomhustemperaturens variation över dygnet.","[(1, 'Dessa', 3), (2, 'har', 3), (3, 'införts', 0), (4, 'i', 5), (5, 'beräkningarna', 3), (6, 'för', 7), (7, 'ventilation', 5), (8, ',', 9), (9, 'köldbryggor', 7), (10, ',', 11), (11, 'transmission', 7), (12, 'och', 13), (13, 'luftläckage', 7), (14, 'då', 17), (15, 'alla', 17), (16, 'är', 17), (17, 'beroende', 3), (18, 'av', 20), (19, 'utomhustemperaturens', 20), (20, 'variation', 17), (21, 'över', 22), (22, 'dygnet', 20), (23, '.', 3)]"
diva107.txt,Slutsats  Detta arbete har visat att energideklarationerna bör göras på ett relativt enkelt  sätt. Boverkets metod för energideklarationer är bra eftersom den inte är särskilt  tidskrävande att utföra. Det är upp till fastighetsägaren om han vill ha utförliga  och genomarbetade förslag till lönsamma åtgärder eller inte.,41.93,Det är upp till fastighetsägaren om han vill ha utförliga  och genomarbetade förslag till lönsamma åtgärder eller inte.,"[(1, 'Det', 2), (2, 'är', 0), (3, 'upp', 2), (4, 'till', 5), (5, 'fastighetsägaren', 2), (6, 'om', 9), (7, 'han', 9), (8, 'vill', 9), (9, 'ha', 2), (10, 'utförliga', 13), (11, 'och', 12), (12, 'genomarbetade', 10), (13, 'förslag', 9), (14, 'till', 16), (15, 'lönsamma', 16), (16, 'åtgärder', 9), (17, 'eller', 16), (18, 'inte', 17), (19, '.', 2)]"
diva108.txt,"Rising costs of energy, combined with an increasing environmental consciousness on the  part of building owners, render timely the law on certification of buildings for energy  efficiency.  The work presented here has investigated the use to clients of new businesses that have  appeared through the certification law, as well as the market place such businesses can  enjoy. The latter has two mainstays, the customers, building owners, on the one hand, and  on the other the agents of control, i. e.",41.0,"Rising costs of energy, combined with an increasing environmental consciousness on the  part of building owners, render timely the law on certification of buildings for energy  efficiency.","[(1, 'Rising', 2), (2, 'costs', 0), (3, 'of', 4), (4, 'energy', 2), (5, ',', 2), (6, 'combined', 7), (7, 'with', 2), (8, 'an', 11), (9, 'increasing', 10), (10, 'environmental', 11), (11, 'consciousness', 7), (12, 'on', 14), (13, 'the', 14), (14, 'part', 11), (15, 'of', 17), (16, 'building', 17), (17, 'owners', 14), (18, ',', 17), (19, 'render', 20), (20, 'timely', 14), (21, 'the', 22), (22, 'law', 20), (23, 'on', 24), (24, 'certification', 22), (25, 'of', 26), (26, 'buildings', 24), (27, 'for', 29), (28, 'energy', 29), (29, 'efficiency', 26), (30, '.', 2)]"
diva109.txt,"It emanates from an EC directive in 2002. The purpose of energy  certification of buildings is efficiency in the use of energy and a reduction of emissions  effecting climate. Buildings account for about 40% of the total use of energy in EU countries.  Rising costs of energy, combined with an increasing environmental consciousness on the  part of building owners, render timely the law on certification of buildings for energy  efficiency.",44.0,"Rising costs of energy, combined with an increasing environmental consciousness on the  part of building owners, render timely the law on certification of buildings for energy  efficiency.","[(1, 'Rising', 2), (2, 'costs', 0), (3, 'of', 4), (4, 'energy', 2), (5, ',', 2), (6, 'combined', 7), (7, 'with', 2), (8, 'an', 11), (9, 'increasing', 10), (10, 'environmental', 11), (11, 'consciousness', 7), (12, 'on', 14), (13, 'the', 14), (14, 'part', 11), (15, 'of', 17), (16, 'building', 17), (17, 'owners', 14), (18, ',', 17), (19, 'render', 20), (20, 'timely', 14), (21, 'the', 22), (22, 'law', 20), (23, 'on', 24), (24, 'certification', 22), (25, 'of', 26), (26, 'buildings', 24), (27, 'for', 29), (28, 'energy', 29), (29, 'efficiency', 26), (30, '.', 2)]"
diva11.txt,Istället öppet i det gemensamma där korridoren utökas till en mötesplats.  PLATS OCH PROGRAM Projektet är en grundskola med 300 elever i årskurserna 1-6  fördelade på två klasser per årskurs.  Skolan är för de framtida stadsdelarna i Norra Djurgårdsstaden och Hjorthagen.,46.21,PLATS OCH PROGRAM Projektet är en grundskola med 300 elever i årskurserna 1-6  fördelade på två klasser per årskurs.,"[(1, 'PLATS', 7), (2, 'OCH', 1), (3, 'PROGRAM', 4), (4, 'Projektet', 1), (5, 'är', 7), (6, 'en', 7), (7, 'grundskola', 0), (8, 'med', 10), (9, '300', 10), (10, 'elever', 7), (11, 'i', 13), (12, 'årskurserna', 13), (13, '1-6', 7), (14, 'fördelade', 13), (15, 'på', 17), (16, 'två', 17), (17, 'klasser', 14), (18, 'per', 19), (19, 'årskurs', 17), (20, '.', 7)]"
diva110.txt,"The suggested solution uses a translation layer called Metadata FTL (MFTL), where ﬁle system metadata and userdata are separated from each other in order to improve performance. The partition holding userdata uses a block-level mapped translation layer system called Fully Associative Sector Translation FTL. The other partition, holding metadata, will instead use a page-level mapped translation layer system which also separates often modiﬁed data from data modiﬁed seldom.",50.36,"The suggested solution uses a translation layer called Metadata FTL (MFTL), where ﬁle system metadata and userdata are separated from each other in order to improve performance.","[(1, 'The', 4), (2, 'suggested', 3), (3, 'solution', 4), (4, 'uses', 0), (5, 'a', 10), (6, 'translation', 7), (7, 'layer', 8), (8, 'called', 9), (9, 'Metadata', 10), (10, 'FTL', 4), (11, '(', 10), (12, 'MFTL', 10), (13, ')', 10), (14, ',', 10), (15, 'where', 18), (16, 'ﬁle', 17), (17, 'system', 18), (18, 'metadata', 10), (19, 'and', 20), (20, 'userdata', 18), (21, 'are', 22), (22, 'separated', 18), (23, 'from', 25), (24, 'each', 25), (25, 'other', 22), (26, 'in', 27), (27, 'order', 25), (28, 'to', 29), (29, 'improve', 30), (30, 'performance', 25), (31, '.', 4)]"
diva111.txt,"Keywords: initial study, object description, measures, climate shell, caution, energy, moisture,  “pay-back times”",64.0,,
diva112.txt,Detta åstadkommes utan att förvanska husets viktiga  kulturhistoriska karaktärsdrag genom ett stort hänsynstagande till varsamhetskrav. Vidare  utvärderas om valda åtgärder har en negativ inverkan per byggnadsdel ur fuktsynpunkt och  slutligen visas att många av åtgärderna även ur ekonomiskt perspektiv är motiverade.,57.57,Vidare  utvärderas om valda åtgärder har en negativ inverkan per byggnadsdel ur fuktsynpunkt och  slutligen visas att många av åtgärderna även ur ekonomiskt perspektiv är motiverade.,"[(1, 'Vidare', 2), (2, 'utvärderas', 0), (3, 'om', 6), (4, 'valda', 5), (5, 'åtgärder', 6), (6, 'har', 2), (7, 'en', 9), (8, 'negativ', 9), (9, 'inverkan', 6), (10, 'per', 11), (11, 'byggnadsdel', 9), (12, 'ur', 13), (13, 'fuktsynpunkt', 6), (14, 'och', 16), (15, 'slutligen', 16), (16, 'visas', 6), (17, 'att', 26), (18, 'många', 26), (19, 'av', 20), (20, 'åtgärderna', 18), (21, 'även', 24), (22, 'ur', 24), (23, 'ekonomiskt', 24), (24, 'perspektiv', 20), (25, 'är', 26), (26, 'motiverade', 16), (27, '.', 2)]"
diva113.txt,"If the actual energy consumption is  significantly below the reference value, we believe that a major, costly investigation is  not necessary.    · Identification of systems and processes, this makes it necessary to examine the type of    heating system, for comfort cooling, etc.    · Visual inspection / investigation of the building with examination of the status of     different parts of the buildings service systems. Check of operating times and set     values.",47.73,"If the actual energy consumption is  significantly below the reference value, we believe that a major, costly investigation is  not necessary.","[(1, 'If', 5), (2, 'the', 5), (3, 'actual', 5), (4, 'energy', 5), (5, 'consumption', 0), (6, 'is', 8), (7, 'significantly', 8), (8, 'below', 5), (9, 'the', 10), (10, 'reference', 11), (11, 'value', 8), (12, ',', 11), (13, 'we', 15), (14, 'believe', 15), (15, 'that', 11), (16, 'a', 17), (17, 'major', 15), (18, ',', 15), (19, 'costly', 20), (20, 'investigation', 15), (21, 'is', 22), (22, 'not', 23), (23, 'necessary', 20), (24, '.', 11)]"
diva114.txt,"Vidare så vill vi tacka:  Mats Vallmark på Isover, för att vi fått tillgång till programmet Isover Energi, Gunnar Anderlind för  lånet av David‐32 samt för den hjälp vi fått med programmet, Thomas Blomberg på Blocon för  lånet av Heat2, Sven Ahlund för hjälp med CAD, Gudni Johannesson, avdelningen Byggnadsteknik,  KTH, för support och tillgång till programmet ”Consolis Energy +”. Ett stort tack till Mats Ola  Rasmusson på Strusoft för tillgång till och för support till programmet VIP+.",49.08,"Vidare så vill vi tacka:  Mats Vallmark på Isover, för att vi fått tillgång till programmet Isover Energi, Gunnar Anderlind för  lånet av David‐32 samt för den hjälp vi fått med programmet, Thomas Blomberg på Blocon för  lånet av Heat2, Sven Ahlund för hjälp med CAD, Gudni Johannesson, avdelningen Byggnadsteknik,  KTH, för support och tillgång till programmet ”Consolis Energy +”.","[(1, 'Vidare', 5), (2, 'så', 5), (3, 'vill', 5), (4, 'vi', 5), (5, 'tacka', 0), (6, ':', 5)]"
diva115.txt,"Den betingade sannolikhetshierarkin använder sig av två andra modeller, oberoendemodellen och fullmodellen, för att skatta relevansen hos ett dokument givet den ställda sökfrågan. Oberoendemodellen gör antagandet att söktermerna i sökfrågan är oberoende varandra men förkastar informationen i ordföljden, medan fullmodellen tar hänsyn till den information ordföljden ger. Resultatet visar att relevansmodellen kan omordna sökresultatet i 98% av fallen.",59.33,"Oberoendemodellen gör antagandet att söktermerna i sökfrågan är oberoende varandra men förkastar informationen i ordföljden, medan fullmodellen tar hänsyn till den information ordföljden ger.","[(1, 'Oberoendemodellen', 2), (2, 'gör', 0), (3, 'antagandet', 2), (4, 'att', 9), (5, 'söktermerna', 9), (6, 'i', 7), (7, 'sökfrågan', 5), (8, 'är', 9), (9, 'oberoende', 2), (10, 'varandra', 9), (11, 'men', 12), (12, 'förkastar', 9), (13, 'informationen', 12), (14, 'i', 15), (15, 'ordföljden', 13), (16, ',', 2), (17, 'medan', 19), (18, 'fullmodellen', 19), (19, 'tar', 2), (20, 'hänsyn', 19), (21, 'till', 23), (22, 'den', 23), (23, 'information', 19), (24, 'ordföljden', 25), (25, 'ger', 23), (26, '.', 2)]"
diva116.txt,"En metod för att sänka energiförbrukningen är att sänka det varvtal som  lastbilens dieselmotor arbetar vid. Vid lägre varvtal jobbar motorn oftast mer  effektivt och en mindre del av motorarbetet försvinner då i förluster, dock kan inte  motorn belastas lika hårt. Varvtalet kan i vissa situationer sänkas under drift av  påbyggnaden. Mellan drift då applikationen väntar på användarens kommando kan  varvtalet alltid sänkas så att energiförbrukningen sjunker.",43.25,"Vid lägre varvtal jobbar motorn oftast mer  effektivt och en mindre del av motorarbetet försvinner då i förluster, dock kan inte  motorn belastas lika hårt.","[(1, 'Vid', 3), (2, 'lägre', 3), (3, 'varvtal', 4), (4, 'jobbar', 0), (5, 'motorn', 4), (6, 'oftast', 4), (7, 'mer', 8), (8, 'effektivt', 4), (9, 'och', 15), (10, 'en', 12), (11, 'mindre', 12), (12, 'del', 15), (13, 'av', 14), (14, 'motorarbetet', 12), (15, 'försvinner', 4), (16, 'då', 15), (17, 'i', 18), (18, 'förluster', 15), (19, ',', 4), (20, 'dock', 24), (21, 'kan', 24), (22, 'inte', 24), (23, 'motorn', 24), (24, 'belastas', 4), (25, 'lika', 26), (26, 'hårt', 24), (27, '.', 4)]"
diva117.txt,"En metod för att sänka energiförbrukningen är att sänka det varvtal som  lastbilens dieselmotor arbetar vid. Vid lägre varvtal jobbar motorn oftast mer  effektivt och en mindre del av motorarbetet försvinner då i förluster, dock kan inte  motorn belastas lika hårt. Varvtalet kan i vissa situationer sänkas under drift av  påbyggnaden. Mellan drift då applikationen väntar på användarens kommando kan  varvtalet alltid sänkas så att energiförbrukningen sjunker.",43.25,"Vid lägre varvtal jobbar motorn oftast mer  effektivt och en mindre del av motorarbetet försvinner då i förluster, dock kan inte  motorn belastas lika hårt.","[(1, 'Vid', 3), (2, 'lägre', 3), (3, 'varvtal', 4), (4, 'jobbar', 0), (5, 'motorn', 4), (6, 'oftast', 4), (7, 'mer', 8), (8, 'effektivt', 4), (9, 'och', 15), (10, 'en', 12), (11, 'mindre', 12), (12, 'del', 15), (13, 'av', 14), (14, 'motorarbetet', 12), (15, 'försvinner', 4), (16, 'då', 15), (17, 'i', 18), (18, 'förluster', 15), (19, ',', 4), (20, 'dock', 24), (21, 'kan', 24), (22, 'inte', 24), (23, 'motorn', 24), (24, 'belastas', 4), (25, 'lika', 26), (26, 'hårt', 24), (27, '.', 4)]"
diva118.txt,"Informanterna	    hade	    bakgrund	    inom	    adderande	    tillverknings-­‐ teknik,	   ortopedi	   och	   protestillverkning.	    	    Teori	   och	   empiriskt	   underlag	   analyserades	   utifrån	   behovsbilden.	   Den	   typ	   av	   protes	   som	   är	    bäst	   lämpad	   att	   tillverka	   med	   adderande	   tillverkning	   är	   en	   enkel	   modell	   av	   kroppsdriven	    mekanisk	    armprotes.",54.24,Den	   typ	   av	   protes	   som	   är	    bäst	   lämpad	   att	   tillverka	   med	   adderande	   tillverkning	   är	   en	   enkel	   modell	   av	   kroppsdriven	    mekanisk	    armprotes.,"[(1, 'Den', 2), (2, 'typ', 17), (3, 'av', 4), (4, 'protes', 2), (5, 'som', 8), (6, 'är', 8), (7, 'bäst', 8), (8, 'lämpad', 2), (9, 'att', 10), (10, 'tillverka', 8), (11, 'med', 13), (12, 'adderande', 13), (13, 'tillverkning', 10), (14, 'är', 17), (15, 'en', 17), (16, 'enkel', 17), (17, 'modell', 0), (18, 'av', 21), (19, 'kroppsdriven', 21), (20, 'mekanisk', 21), (21, 'armprotes', 17), (22, '.', 17)]"
diva119.txt,"When AM is used as a manufacturing method, there are a number of advantages  that follows. One of the greatest advantages is the resource efficient manufacturing, with aspect to  material efficiency, shortened developing time and a less complex design. But, regardless of these,  AM is still standing in front of some challenges to further replace the traditional manufacturing  methods and gain a larger market share.",48.56,"But, regardless of these,  AM is still standing in front of some challenges to further replace the traditional manufacturing  methods and gain a larger market share.","[(1, 'But', 0), (2, ',', 1), (3, 'regardless', 1), (4, 'of', 5), (5, 'these', 3), (6, ',', 3), (7, 'AM', 3), (8, 'is', 10), (9, 'still', 10), (10, 'standing', 7), (11, 'in', 12), (12, 'front', 10), (13, 'of', 15), (14, 'some', 15), (15, 'challenges', 12), (16, 'to', 18), (17, 'further', 18), (18, 'replace', 15), (19, 'the', 22), (20, 'traditional', 21), (21, 'manufacturing', 22), (22, 'methods', 18), (23, 'and', 24), (24, 'gain', 22), (25, 'a', 26), (26, 'larger', 27), (27, 'market', 28), (28, 'share', 24), (29, '.', 1)]"
diva12.txt,Dessa friare placeringsregler gör att man kan  använda sig av korta positioner på marknaden och därmed framkommer möjligheten att vara  marknadsneutrala.  Genom marknadsneutralitetsmöjligheten bildades begreppet absolut avkastning där de olika  fonderna i sin marknadsföring proklamerade att målet är att varje år leverera stabila  avkastningssiffror som inte blir påverkade av marknaden.,56.67,Genom marknadsneutralitetsmöjligheten bildades begreppet absolut avkastning där de olika  fonderna i sin marknadsföring proklamerade att målet är att varje år leverera stabila  avkastningssiffror som inte blir påverkade av marknaden.,"[(1, 'Genom', 2), (2, 'marknadsneutralitetsmöjligheten', 3), (3, 'bildades', 0), (4, 'begreppet', 6), (5, 'absolut', 6), (6, 'avkastning', 3), (7, 'där', 14), (8, 'de', 10), (9, 'olika', 10), (10, 'fonderna', 14), (11, 'i', 13), (12, 'sin', 13), (13, 'marknadsföring', 14), (14, 'proklamerade', 6), (15, 'att', 21), (16, 'målet', 17), (17, 'är', 14), (18, 'att', 21), (19, 'varje', 20), (20, 'år', 21), (21, 'leverera', 17), (22, 'stabila', 23), (23, 'avkastningssiffror', 21), (24, 'som', 27), (25, 'inte', 27), (26, 'blir', 27), (27, 'påverkade', 23), (28, 'av', 29), (29, 'marknaden', 27), (30, '.', 3)]"
diva120.txt,"The idea for my thesis began to emerge last year  when I was studying as an exchange student in  the US, in west coast city Seattle. The city is cur­ rently growing and densifying in a rapid pace and  most of the new buildings are being built in exis­ ting environments. The vast majority is creating  big contrasts in the city environment.",34.85,The city is cur­ rently growing and densifying in a rapid pace and  most of the new buildings are being built in exis­ ting environments.,"[(1, 'The', 2), (2, 'city', 0), (3, 'is', 6), (4, 'cur\xad', 6), (5, 'rently', 6), (6, 'growing', 2), (7, 'and', 8), (8, 'densifying', 6), (9, 'in', 12), (10, 'a', 11), (11, 'rapid', 12), (12, 'pace', 8), (13, 'and', 14), (14, 'most', 12), (15, 'of', 18), (16, 'the', 17), (17, 'new', 18), (18, 'buildings', 14), (19, 'are', 21), (20, 'being', 21), (21, 'built', 18), (22, 'in', 25), (23, 'exis\xad', 24), (24, 'ting', 25), (25, 'environments', 21), (26, '.', 2)]"
diva121.txt,"The more I learn about this city, the more fascinated I get. Even though it’s young, it has already transformed  itself multiple times and survived both super expansive growth and fire and depression. But it is also a city  where the different eras have put its mark, and you can clearly read the layers of development.  But I’m afraid that some things will get lost, some of the things that make Seattle special.",31.0,"Even though it’s young, it has already transformed  itself multiple times and survived both super expansive growth and fire and depression.","[(1, 'Even', 4), (2, 'though', 4), (3, 'it’s', 4), (4, 'young', 0), (5, ',', 4), (6, 'it', 4), (7, 'has', 9), (8, 'already', 9), (9, 'transformed', 4), (10, 'itself', 12), (11, 'multiple', 12), (12, 'times', 9), (13, 'and', 15), (14, 'survived', 15), (15, 'both', 18), (16, 'super', 17), (17, 'expansive', 18), (18, 'growth', 12), (19, 'and', 20), (20, 'fire', 18), (21, 'and', 22), (22, 'depression', 20), (23, '.', 4)]"
