File,Paragraph,LIX Score,Longest Sentence,Dependency Parse
diva50.txt,"The process for purchase is  considered by many to be a key factor in businesses work towards sustainable  development. Key people in this process and target audience for this education is  environmental, purchasing and procurement managers.     The purpose of this study is to design an education called Miljösäkrade inköp from the  target audiences’ knowledge, interests and attitudes, together with literature.",53.33,"The purpose of this study is to design an education called Miljösäkrade inköp from the  target audiences’ knowledge, interests and attitudes, together with literature.","[(1, 'The', 2), (2, 'purpose', 0), (3, 'of', 5), (4, 'this', 5), (5, 'study', 2), (6, 'is', 8), (7, 'to', 8), (8, 'design', 5), (9, 'an', 10), (10, 'education', 11), (11, 'called', 12), (12, 'Miljösäkrade', 13), (13, 'inköp', 8), (14, 'from', 19), (15, 'the', 16), (16, 'target', 17), (17, 'audiences', 19), (18, '’', 19), (19, 'knowledge', 13), (20, ',', 19), (21, 'interests', 19), (22, 'and', 23), (23, 'attitudes', 21), (24, ',', 19), (25, 'together', 26), (26, 'with', 27), (27, 'literature', 23), (28, '.', 2)]"
diva51.txt,"Konceptet som skall undersökas är att reglera turbininloppstrycket  med en bypassventil förbi turbinen, likt en extern wastegate.  För att dimensionera denna bypassventil inför tillverkning samt för  att undersöka bypassventilens inverkan på motorn utfördes  simuleringar i GT-Power. Därefter validerades konceptet med VGT- bromsning och bypassventil i motorprov på en Scania V8.  Resultaten  från  motorprovet  visar  på  en  mycket  god  avgasbromsprestanda.",52.0,För att dimensionera denna bypassventil inför tillverkning samt för  att undersöka bypassventilens inverkan på motorn utfördes  simuleringar i GT-Power.,"[(1, 'För', 3), (2, 'att', 3), (3, 'dimensionera', 16), (4, 'denna', 5), (5, 'bypassventil', 3), (6, 'inför', 7), (7, 'tillverkning', 3), (8, 'samt', 11), (9, 'för', 11), (10, 'att', 11), (11, 'undersöka', 3), (12, 'bypassventilens', 13), (13, 'inverkan', 11), (14, 'på', 15), (15, 'motorn', 13), (16, 'utfördes', 0), (17, 'simuleringar', 16), (18, 'i', 19), (19, 'GT-Power', 16), (20, '.', 16)]"
diva52.txt,Den modell som har skapats har visat sig producera mycket bra resultat och de slutsatser som  kan dras  av  detta  arbete är att  vattenkraften har mycket goda  möjligheter att balansera den  ojämna  vindkraftsproduktionen.  Endast  enstaka  fall  har  påträffats  där  spill  uppstår  trots  att  ledig kapacitet har funnits och de stora spill som påträffas bland resultaten kan avhjälpas med  bättre säsongsplanering.,48.33,Den modell som har skapats har visat sig producera mycket bra resultat och de slutsatser som  kan dras  av  detta  arbete är att  vattenkraften har mycket goda  möjligheter att balansera den  ojämna  vindkraftsproduktionen.,"[(1, 'Den', 2), (2, 'modell', 7), (3, 'som', 5), (4, 'har', 5), (5, 'skapats', 2), (6, 'har', 7), (7, 'visat', 0), (8, 'sig', 7), (9, 'producera', 7), (10, 'mycket', 11), (11, 'bra', 12), (12, 'resultat', 9), (13, 'och', 15), (14, 'de', 15), (15, 'slutsatser', 7), (16, 'som', 18), (17, 'kan', 18), (18, 'dras', 15), (19, 'av', 21), (20, 'detta', 21), (21, 'arbete', 18), (22, 'är', 7), (23, 'att', 25), (24, 'vattenkraften', 25), (25, 'har', 7), (26, 'mycket', 27), (27, 'goda', 28), (28, 'möjligheter', 25), (29, 'att', 30), (30, 'balansera', 28), (31, 'den', 33), (32, 'ojämna', 33), (33, 'vindkraftsproduktionen', 30), (34, '.', 7)]"
diva53.txt,"En lyftanordning med tre frihetsgrader anpassad för att lyfta batterier utvecklades,  byggdes och testades. Den utvecklade lyftanordningen består av tre moduler, en ram som  fästs i respektive batterienhet i basstationen innan lyftet påbörjas, en korg som batteriet  ligger i under lyftet samt en vagn som batterierna transporteras på fram till  telekomstationens batterienhet. Systemet medför att batterierna ej behöver lyftas manuellt  efter de placerats på batterivagnen.",54.71,"Den utvecklade lyftanordningen består av tre moduler, en ram som  fästs i respektive batterienhet i basstationen innan lyftet påbörjas, en korg som batteriet  ligger i under lyftet samt en vagn som batterierna transporteras på fram till  telekomstationens batterienhet.","[(1, 'Den', 3), (2, 'utvecklade', 3), (3, 'lyftanordningen', 4), (4, 'består', 0), (5, 'av', 7), (6, 'tre', 7), (7, 'moduler', 4), (8, ',', 7), (9, 'en', 10), (10, 'ram', 7), (11, 'som', 12), (12, 'fästs', 10), (13, 'i', 15), (14, 'respektive', 15), (15, 'batterienhet', 12), (16, 'i', 17), (17, 'basstationen', 15), (18, 'innan', 20), (19, 'lyftet', 20), (20, 'påbörjas', 12), (21, ',', 23), (22, 'en', 23), (23, 'korg', 7), (24, 'som', 26), (25, 'batteriet', 26), (26, 'ligger', 23), (27, 'i', 29), (28, 'under', 29), (29, 'lyftet', 26), (30, 'samt', 32), (31, 'en', 32), (32, 'vagn', 29), (33, 'som', 35), (34, 'batterierna', 35), (35, 'transporteras', 32), (36, 'på', 37), (37, 'fram', 35), (38, 'till', 40), (39, 'telekomstationens', 40), (40, 'batterienhet', 37), (41, '.', 4)]"
diva54.txt,"Arbetet motsvarar 30  högskolepoäng och har utförts mellan januari och juni 2009.  Jag vill tacka alla som direkt eller indirekt har varit inblandade i examensarbetets  genomförande. Ett särskilt tack vill jag rikta till mina handledare Åke Bjurholm och Anders  Wiberg på Grontmij för all hjälp, stöd och rådgivning under tiden på Grontmij.   Jag vill också tacka min handledare prof. Håkan Sundquist på Brobyggnad KTH för hans  goda råd.   Ett särskilt stort tack riktar jag åt tekn. lic.",34.3,"Ett särskilt tack vill jag rikta till mina handledare Åke Bjurholm och Anders  Wiberg på Grontmij för all hjälp, stöd och rådgivning under tiden på Grontmij.","[(1, 'Ett', 3), (2, 'särskilt', 3), (3, 'tack', 6), (4, 'vill', 6), (5, 'jag', 6), (6, 'rikta', 0), (7, 'till', 10), (8, 'mina', 9), (9, 'handledare', 10), (10, 'Åke', 6), (11, 'Bjurholm', 10), (12, 'och', 13), (13, 'Anders', 10), (14, 'Wiberg', 13), (15, 'på', 16), (16, 'Grontmij', 13), (17, 'för', 19), (18, 'all', 19), (19, 'hjälp', 6), (20, ',', 21), (21, 'stöd', 19), (22, 'och', 23), (23, 'rådgivning', 19), (24, 'under', 25), (25, 'tiden', 19), (26, 'på', 27), (27, 'Grontmij', 25), (28, '.', 6)]"
diva55.txt,"Marknaden för befuktare studerades och de vanligast använda befuktningsmetoderna granskades  för att hitta svagheter som behövde åtgärdas. De två vanligaste befuktartyperna är Heated  Humidifier och Heat and Moisture Exchanger. Den främsta nackdelen med Heated Humidifier  var dess tendens att övermätta luften med kondensutfällning som följd, och med Heat and  Moisture Exhanger att inte tillräckliga fukt- och temperaturnivåer nåddes.",57.6,"Den främsta nackdelen med Heated Humidifier  var dess tendens att övermätta luften med kondensutfällning som följd, och med Heat and  Moisture Exhanger att inte tillräckliga fukt- och temperaturnivåer nåddes.","[(1, 'Den', 3), (2, 'främsta', 3), (3, 'nackdelen', 0), (4, 'med', 5), (5, 'Heated', 3)]"
diva56.txt,"Examensarbetet är utfört på el- utvecklingen på Volvo Car Corporation (VCC) i Göteborg med start i augusti 2006. VCC är  idag en del av företaget Ford Motor Company (FMC). Det globala samarbetet inom FMC  är mellan Ford Europa, Ford Nordamerika, Jaguar, Land Rover, Mazda och Volvo Car  Corporation.     Samarbetet inom FMC har bidragit till att el-utvecklingen på VCC står inför helt nya  utmaningar avseende systemlösningar för informations- och kravhantering.",41.14,Samarbetet inom FMC har bidragit till att el-utvecklingen på VCC står inför helt nya  utmaningar avseende systemlösningar för informations- och kravhantering.,"[(1, 'Samarbetet', 5), (2, 'inom', 3), (3, 'FMC', 1), (4, 'har', 5), (5, 'bidragit', 0), (6, 'till', 11), (7, 'att', 11), (8, 'el-utvecklingen', 11), (9, 'på', 10), (10, 'VCC', 8), (11, 'står', 5), (12, 'inför', 15), (13, 'helt', 14), (14, 'nya', 15), (15, 'utmaningar', 11), (16, 'avseende', 17), (17, 'systemlösningar', 15), (18, 'för', 19), (19, 'informations-', 17), (20, 'och', 21), (21, 'kravhantering', 19), (22, '.', 5)]"
diva57.txt,"Programmet är därför skrivet på engelska.    Programmet skapades i utvecklingsmiljön Microsoft Visual C# 2008 Express Edition. Det  innehåller funktioner för att enkelt skapa ett grafiskt användargränssnitt. Logiken i  programmet är skrivet i programmeringsspråket C#. Resultatet är ett fristående program som  inte kräver någon installation, dock krävs att plattformen Microsoft .NET Framework 3.5 är  installerat på användarens dator.",52.08,"Resultatet är ett fristående program som  inte kräver någon installation, dock krävs att plattformen Microsoft .","[(1, 'Resultatet', 5), (2, 'är', 5), (3, 'ett', 5), (4, 'fristående', 5), (5, 'program', 0), (6, 'som', 8), (7, 'inte', 8), (8, 'kräver', 5), (9, 'någon', 10), (10, 'installation', 8), (11, ',', 5), (12, 'dock', 13), (13, 'krävs', 5), (14, 'att', 16), (15, 'plattformen', 16), (16, 'Microsoft', 13), (17, '.', 5)]"
diva58.txt,Syftet med projektet var att ta fram beräknings- och simuleringsverktyg för plattformar  som används av ABB FACTS i deras seriekompenseringsanläggningar. Examensarbetet har även  fungerat som en utvärdering av FEM programmet SolidWorks Simulation.    Examensarbetet inleddes med en förstudie där de normer och standarder som ABB FACTS  måste ha i åtanke vid konstruerande undersöktes.,47.62,Syftet med projektet var att ta fram beräknings- och simuleringsverktyg för plattformar  som används av ABB FACTS i deras seriekompenseringsanläggningar.,"[(1, 'Syftet', 4), (2, 'med', 3), (3, 'projektet', 1), (4, 'var', 0), (5, 'att', 6), (6, 'ta', 4), (7, 'fram', 6), (8, 'beräknings-', 6), (9, 'och', 10), (10, 'simuleringsverktyg', 8), (11, 'för', 12), (12, 'plattformar', 6), (13, 'som', 14), (14, 'används', 12), (15, 'av', 17), (16, 'ABB', 17), (17, 'FACTS', 14), (18, 'i', 20), (19, 'deras', 20), (20, 'seriekompenseringsanläggningar', 14), (21, '.', 4)]"
diva59.txt,"We enjoyed exposure to numerous articulate people within the company. Special  acknowledgements are directed towards Cecilia, Jan, Joakim, Niklas and Susanne for  their great support when comprehending the particular problem we solved together.",59.48,"Special  acknowledgements are directed towards Cecilia, Jan, Joakim, Niklas and Susanne for  their great support when comprehending the particular problem we solved together.","[(1, 'Special', 2), (2, 'acknowledgements', 0), (3, 'are', 6), (4, 'directed', 5), (5, 'towards', 6), (6, 'Cecilia', 2), (7, ',', 6), (8, 'Jan', 6), (9, ',', 8), (10, 'Joakim', 8), (11, ',', 6), (12, 'Niklas', 6), (13, 'and', 14), (14, 'Susanne', 12), (15, 'for', 18), (16, 'their', 17), (17, 'great', 18), (18, 'support', 12), (19, 'when', 20), (20, 'comprehending', 12), (21, 'the', 23), (22, 'particular', 23), (23, 'problem', 20), (24, 'we', 25), (25, 'solved', 26), (26, 'together', 20), (27, '.', 2)]"
diva6.txt,Syftet med examensarbetet är att kartlägga förutsättningar för tillämpning av 4D-planering i  produktionsskedet. Syftet är även att undersöka och kunskapsåterföra 4D-planering till ett  byggföretag i Sverige. En enkätundersökning har skickats ut till projektverksamma  medarbetare aktiva i Stockholmsområdet för att redogöra för i vilken omfattning 4D-planering  tidigare har använts.,53.93,En enkätundersökning har skickats ut till projektverksamma  medarbetare aktiva i Stockholmsområdet för att redogöra för i vilken omfattning 4D-planering  tidigare har använts.,"[(1, 'En', 2), (2, 'enkätundersökning', 4), (3, 'har', 4), (4, 'skickats', 0), (5, 'ut', 4), (6, 'till', 8), (7, 'projektverksamma', 8), (8, 'medarbetare', 4), (9, 'aktiva', 8), (10, 'i', 11), (11, 'Stockholmsområdet', 9), (12, 'för', 14), (13, 'att', 14), (14, 'redogöra', 4), (15, 'för', 22), (16, 'i', 18), (17, 'vilken', 18), (18, 'omfattning', 22), (19, '4D-planering', 22), (20, 'tidigare', 22), (21, 'har', 22), (22, 'använts', 14), (23, '.', 4)]"
diva60.txt,"Kopplas en kostnad till den f¨orv¨antade avbrottstiden i uttagspunkterna kan den f¨orv¨antade avbrotts- kostnaden f¨or distributionssystemet ber¨aknas. Syftet med simuleringarna har varit att unders¨oka om det g˚ar att minimera den totala kostnaden, investeringskostnader samt f¨orv¨antade avbrottskost- nad, genom slumpvisa investeringar i systemets ledningssektioner. Simuler- ingarna har genomf¨orts p˚a ett ﬁktivt mindre system.",44.12,"Syftet med simuleringarna har varit att unders¨oka om det g˚ar att minimera den totala kostnaden, investeringskostnader samt f¨orv¨antade avbrottskost- nad, genom slumpvisa investeringar i systemets ledningssektioner.","[(1, 'Syftet', 7), (2, 'med', 3), (3, 'simuleringarna', 1), (4, 'har', 7), (5, 'varit', 7), (6, 'att', 7), (7, 'unders¨oka', 0), (8, 'om', 10), (9, 'det', 10), (10, 'g˚ar', 7), (11, 'att', 12), (12, 'minimera', 10), (13, 'den', 15), (14, 'totala', 15), (15, 'kostnaden', 12), (16, ',', 17), (17, 'investeringskostnader', 15), (18, 'samt', 21), (19, 'f¨orv¨antade', 20), (20, 'avbrottskost-', 21), (21, 'nad', 15), (22, ',', 12), (23, 'genom', 25), (24, 'slumpvisa', 25), (25, 'investeringar', 12), (26, 'i', 28), (27, 'systemets', 28), (28, 'ledningssektioner', 25), (29, '.', 7)]"
diva61.txt,"Simulatorn har både haptik och stereograﬁk som kan förmedla djupinformation. Frågeställningen för examensarbetet var därför att undersöka om det fanns något behov av att använda sig av en relativt beräkningstung rendering med skuggning, eller om det skulle duga med en enklare typ av rendering. Användartester har utförts med erfarna tandläkare som har fått prova på simulatorn med olika typer av renderingar av ett och samma patientfall.",48.32,"Frågeställningen för examensarbetet var därför att undersöka om det fanns något behov av att använda sig av en relativt beräkningstung rendering med skuggning, eller om det skulle duga med en enklare typ av rendering.","[(1, 'Frågeställningen', 7), (2, 'för', 3), (3, 'examensarbetet', 1), (4, 'var', 7), (5, 'därför', 7), (6, 'att', 7), (7, 'undersöka', 0), (8, 'om', 10), (9, 'det', 10), (10, 'fanns', 7), (11, 'något', 12), (12, 'behov', 10), (13, 'av', 15), (14, 'att', 15), (15, 'använda', 12), (16, 'sig', 15), (17, 'av', 21), (18, 'en', 21), (19, 'relativt', 20), (20, 'beräkningstung', 21), (21, 'rendering', 15), (22, 'med', 23), (23, 'skuggning', 21), (24, ',', 29), (25, 'eller', 29), (26, 'om', 29), (27, 'det', 29), (28, 'skulle', 29), (29, 'duga', 10), (30, 'med', 33), (31, 'en', 33), (32, 'enklare', 33), (33, 'typ', 29), (34, 'av', 35), (35, 'rendering', 33), (36, '.', 7)]"
diva62.txt,Utveckling och verifiering kommer att kunna ske på sammanbyggd blocknivå.  Idag provas separatorer som en färdig sammanbyggd enhet. Många faktorer påverkar  provresultaten och problem som konstateras är svåra att identifiera. I produktion leder  detta ofta till leveransförseningar.       Syftet med arbetet är att utveckla en testrigg som uppfyller kraven för separat testbarhet  av hermetiska utloppsmoduler.,49.74,Syftet med arbetet är att utveckla en testrigg som uppfyller kraven för separat testbarhet  av hermetiska utloppsmoduler.,"[(1, 'Syftet', 4), (2, 'med', 3), (3, 'arbetet', 1), (4, 'är', 0), (5, 'att', 6), (6, 'utveckla', 4), (7, 'en', 8), (8, 'testrigg', 6), (9, 'som', 10), (10, 'uppfyller', 8), (11, 'kraven', 10), (12, 'för', 14), (13, 'separat', 14), (14, 'testbarhet', 11), (15, 'av', 17), (16, 'hermetiska', 17), (17, 'utloppsmoduler', 14), (18, '.', 4)]"
diva63.txt,"Syftet med projektet var att ta fram ett förslag på koncept som kan ersätta/komplettera dagens  bärbara stege och underlätta vid räddningsinsatser genom att förenkla transporten till  olycksplatsen.   För att utveckla brandstegen tillämpades en systematisk produktutvecklingsmetod. Projektet  delades in i fem faser: projektplanering, konceptgenerering, konceptval, konceptbearbetning  samt presentation.",59.92,Syftet med projektet var att ta fram ett förslag på koncept som kan ersätta/komplettera dagens  bärbara stege och underlätta vid räddningsinsatser genom att förenkla transporten till  olycksplatsen.,"[(1, 'Syftet', 4), (2, 'med', 3), (3, 'projektet', 1), (4, 'var', 0), (5, 'att', 6), (6, 'ta', 4), (7, 'fram', 6), (8, 'ett', 9), (9, 'förslag', 6), (10, 'på', 11), (11, 'koncept', 9), (12, 'som', 14), (13, 'kan', 14), (14, 'ersätta/komplettera', 9), (15, 'dagens', 17), (16, 'bärbara', 17), (17, 'stege', 14), (18, 'och', 19), (19, 'underlätta', 14), (20, 'vid', 21), (21, 'räddningsinsatser', 19), (22, 'genom', 24), (23, 'att', 24), (24, 'förenkla', 19), (25, 'transporten', 24), (26, 'till', 27), (27, 'olycksplatsen', 25), (28, '.', 4)]"
diva64.txt,"Det är även viktigt att bromspedalens beteende  och bromskänslan, dvs. förarens upplevelse då han/hon bromsar, inte förändras på grund av  spelet vid beläggen.     För att kunna ställa upp en modell för spelets påverkan i pedalen studerades ett bromssystem  från en Saab 9-3.",42.82,För att kunna ställa upp en modell för spelets påverkan i pedalen studerades ett bromssystem  från en Saab 9-3.,"[(1, 'För', 4), (2, 'att', 4), (3, 'kunna', 4), (4, 'ställa', 13), (5, 'upp', 4), (6, 'en', 7), (7, 'modell', 4), (8, 'för', 10), (9, 'spelets', 10), (10, 'påverkan', 4), (11, 'i', 12), (12, 'pedalen', 10), (13, 'studerades', 0), (14, 'ett', 15), (15, 'bromssystem', 13), (16, 'från', 19), (17, 'en', 18), (18, 'Saab', 19), (19, '9-3', 15), (20, '.', 13)]"
diva65.txt,Förståelsen ges genom att teori inom ämnet  sammanställts och utförda BIM-projekt identifierats. Olika discipliners och individers sätt att  agera och tänka i byggprocessen förklaras genom en intervjustudie som genomförts.     Begreppet BIM används flitigt inom byggbranschen. Problemet är att ingen har en klar  förståelse för vad BIM är och vad det innebär. Var individ har sin definition av begreppet.,45.43,Olika discipliners och individers sätt att  agera och tänka i byggprocessen förklaras genom en intervjustudie som genomförts.,"[(1, 'Olika', 2), (2, 'discipliners', 5), (3, 'och', 4), (4, 'individers', 2), (5, 'sätt', 12), (6, 'att', 7), (7, 'agera', 5), (8, 'och', 9), (9, 'tänka', 7), (10, 'i', 11), (11, 'byggprocessen', 7), (12, 'förklaras', 0), (13, 'genom', 15), (14, 'en', 15), (15, 'intervjustudie', 12), (16, 'som', 17), (17, 'genomförts', 15), (18, '.', 12)]"
diva66.txt,Most of today's building damages can be linked to moisture.  Moisture also plays a significant role in health problems related to indoor climate.  Building physics is despite this rarely discussed seriously during the building design  phase. Possible reasons include unclear responsibilities; short-term economic focus; a  fragmentized building process; and lack of proper training and competence.,55.26,Possible reasons include unclear responsibilities; short-term economic focus; a  fragmentized building process; and lack of proper training and competence.,"[(1, 'Possible', 5), (2, 'reasons', 5), (3, 'include', 5), (4, 'unclear', 5), (5, 'responsibilities', 0), (6, ';', 5), (7, 'short-term', 8), (8, 'economic', 9), (9, 'focus', 5), (10, ';', 9), (11, 'a', 14), (12, 'fragmentized', 13), (13, 'building', 14), (14, 'process', 9), (15, ';', 14), (16, 'and', 17), (17, 'lack', 14), (18, 'of', 20), (19, 'proper', 20), (20, 'training', 17), (21, 'and', 22), (22, 'competence', 20), (23, '.', 5)]"
diva67.txt,"The number of experts responsible for different parts of the  design should, however, be kept to a minimum.",36.78,"The number of experts responsible for different parts of the  design should, however, be kept to a minimum.","[(1, 'The', 2), (2, 'number', 0), (3, 'of', 5), (4, 'experts', 5), (5, 'responsible', 2), (6, 'for', 8), (7, 'different', 8), (8, 'parts', 5), (9, 'of', 12), (10, 'the', 11), (11, 'design', 12), (12, 'should', 8), (13, ',', 12), (14, 'however', 12), (15, ',', 12), (16, 'be', 17), (17, 'kept', 14), (18, 'to a', 19), (19, 'minimum', 17), (20, '.', 2)]"
diva68.txt,"Min förhoppning är att beskrivningen i  denna rapport av hur referenssystemsbytet gjordes, kan vara till nytta för de kommuner som  av olika anledningar ännu inte kommit igång med motsvarande arbete.",41.67,"Min förhoppning är att beskrivningen i  denna rapport av hur referenssystemsbytet gjordes, kan vara till nytta för de kommuner som  av olika anledningar ännu inte kommit igång med motsvarande arbete.","[(1, 'Min', 2), (2, 'förhoppning', 0), (3, 'är', 2), (4, 'att', 17), (5, 'beskrivningen', 17), (6, 'i', 8), (7, 'denna', 8), (8, 'rapport', 5), (9, 'av', 12), (10, 'hur', 12), (11, 'referenssystemsbytet', 12), (12, 'gjordes', 8), (13, ',', 17), (14, 'kan', 17), (15, 'vara', 17), (16, 'till', 17), (17, 'nytta', 2), (18, 'för', 20), (19, 'de', 20), (20, 'kommuner', 17), (21, 'som', 27), (22, 'av', 24), (23, 'olika', 24), (24, 'anledningar', 27), (25, 'ännu', 27), (26, 'inte', 27), (27, 'kommit', 20), (28, 'igång', 27), (29, 'med', 31), (30, 'motsvarande', 31), (31, 'arbete', 27), (32, '.', 2)]"
diva69.txt,"Stockholm, oktober år 2009    Elina Wetterblad        ii          iii    Sammanfattning     Under tidigare delen av 1960-talet var det akut bostadskris i Sverige. Det fanns inte  tillräckligt med lägenheter för den snabbt växande befolkningen och den generella  bostadsstandarden var låg. För att lösa bostadskrisen satte riksdagen som mål att en  miljon bostäder skulle byggas under perioden 1965-1974.",44.36,"Stockholm, oktober år 2009    Elina Wetterblad        ii          iii    Sammanfattning     Under tidigare delen av 1960-talet var det akut bostadskris i Sverige.","[(1, 'Stockholm', 0), (2, ',', 3), (3, 'oktober', 1), (4, 'år', 5), (5, '2009', 3), (6, 'Elina', 1), (7, 'Wetterblad', 6), (8, 'ii', 6), (9, 'iii', 10), (10, 'Sammanfattning', 6)]"
diva7.txt,Samtidigt  bör den gärna ligga i en öppen miljö för översikt. De hörnytor som skapas utanför basrummen är således optimala för  studiero samt trygghet. Trygghet skapas också genom de långa gallerierna som löper i entréplan. Dessa har dubbel  takhöjd och är öppna mot de övre planen vilket skapar siktlinjer genom hela byggnaden. Gallerierna har fått sitt namn  då de erbjuder inblickar i de specialsalar som är samlade på bottenplan.,41.93,Dessa har dubbel  takhöjd och är öppna mot de övre planen vilket skapar siktlinjer genom hela byggnaden.,"[(1, 'Dessa', 2), (2, 'har', 0), (3, 'dubbel', 4), (4, 'takhöjd', 2), (5, 'och', 7), (6, 'är', 7), (7, 'öppna', 2), (8, 'mot', 11), (9, 'de', 11), (10, 'övre', 11), (11, 'planen', 7), (12, 'vilket', 13), (13, 'skapar', 11), (14, 'siktlinjer', 13), (15, 'genom', 17), (16, 'hela', 17), (17, 'byggnaden', 13), (18, '.', 2)]"
diva70.txt,"Främst vill jag tacka Åke Granmo vid Kristineberg Marina Forskningsstation, Bo Jansson vid  tillämpad  miljövetenskap,  Stockholms  Universitet  och  Kurt  Haglund  vid  Kemikalieinspektionen samt Hans Blanck vid Göteborgs Universitet för alla svar på frågor  samt all övrig information och hjälp. Jag vill tacka Björn Frostell för all den nedlaga tiden och  för konstruktiv kritik samt korrekturläsning. Mikael Eriksson vill jag tacka för  korrekturläsning och svar på frågor.",43.77,"Främst vill jag tacka Åke Granmo vid Kristineberg Marina Forskningsstation, Bo Jansson vid  tillämpad  miljövetenskap,  Stockholms  Universitet  och  Kurt  Haglund  vid  Kemikalieinspektionen samt Hans Blanck vid Göteborgs Universitet för alla svar på frågor  samt all övrig information och hjälp.","[(1, 'Främst', 4), (2, 'vill', 4), (3, 'jag', 4), (4, 'tacka', 0), (5, 'Åke', 4), (6, 'Granmo', 5), (7, 'vid', 8), (8, 'Kristineberg', 4), (9, 'Marina', 10), (10, 'Forskningsstation', 8), (11, ',', 12), (12, 'Bo', 5), (13, 'Jansson', 12), (14, 'vid', 16), (15, 'tillämpad', 16), (16, 'miljövetenskap', 12), (17, ',', 19), (18, 'Stockholms', 19), (19, 'Universitet', 16), (20, 'och', 21), (21, 'Kurt', 16), (22, 'Haglund', 21), (23, 'vid', 24), (24, 'Kemikalieinspektionen', 4), (25, 'samt', 26), (26, 'Hans', 24), (27, 'Blanck', 26), (28, 'vid', 30), (29, 'Göteborgs', 30), (30, 'Universitet', 26), (31, 'för', 33), (32, 'alla', 33), (33, 'svar', 26), (34, 'på', 35), (35, 'frågor', 33), (36, 'samt', 39), (37, 'all', 39), (38, 'övrig', 39), (39, 'information', 35), (40, 'och', 41), (41, 'hjälp', 39), (42, '.', 4)]"
diva71.txt,"Arbetet omfattar i  grova drag fyra delar:  1. Kartläggning av entreprenadbranschen: En kartläggning har utförts för att den  potentiella avsättningen för fleet management produkter, ska kunna bedömas.    2. Behovsanalys: Behovsanalysen har undersökt vad maskinentreprenörerna behöver  hjälp med och sökt svara på följande två frågor: Vika behov är centrala? Och möts  dessa behov av existerande produkter?  3.",43.71,"Kartläggning av entreprenadbranschen: En kartläggning har utförts för att den  potentiella avsättningen för fleet management produkter, ska kunna bedömas.","[(1, 'Kartläggning', 0), (2, 'av', 3), (3, 'entreprenadbranschen', 1), (4, ':', 1)]"
